{
  "$schema": "https://ashlar.dev/schemas/agency-theme.schema.json",
  "name": "default",
  "title": "Default",
  "description": "Default public-service baseline grounded in USWDS design-token conventions. Selected when no agency theme is applied.",
  "provenance": {
    "status": "source-derived",
    "reviewedAt": "2026-05-07",
    "reviewedBy": "BLEN",
    "summary": "Derived from public USWDS token guidance and system-token values; not an official USWDS theme or government endorsement."
  },
  "sources": [
    {
      "label": "USWDS color guidance",
      "url": "https://designsystem.digital.gov/design-tokens/color/overview/",
      "note": "Uses the USWDS theme/system token model and contrast-first color guidance.",
      "retrievedAt": "2026-05-07",
      "tokenPaths": ["color.page", "color.surface", "color.action.*", "color.status.*"]
    },
    {
      "label": "USWDS system color tokens",
      "url": "https://designsystem.digital.gov/design-tokens/color/system-tokens/",
      "note": "Maps the default blue and neutral values to USWDS system token families.",
      "retrievedAt": "2026-05-07",
      "tokenPaths": ["color.action.primary.bg", "color.action.primary.hover", "color.text.*"]
    },
    {
      "label": "USWDS font tokens",
      "url": "https://designsystem.digital.gov/design-tokens/typesetting/font/",
      "note": "Keeps Public Sans and system fallback alignment with USWDS type settings.",
      "retrievedAt": "2026-05-07",
      "tokenPaths": ["font.sans"]
    }
  ],
  "order": 0,
  "tokens": {
    "color": {
      "page": {
        "$type": "color",
        "$value": "#f7f9fb"
      },
      "surface": {
        "$type": "color",
        "$value": "#ffffff"
      },
      "surfaceRaised": {
        "$type": "color",
        "$value": "#ffffff"
      },
      "surfaceSubtle": {
        "$type": "color",
        "$value": "#eef3f7"
      },
      "surfaceMuted": {
        "$type": "color",
        "$value": "{color.surfaceSubtle}"
      },
      "border": {
        "$type": "color",
        "$value": "#c9d4df"
      },
      "borderSubtle": {
        "$type": "color",
        "$value": "{color.border}"
      },
      "inputBorder": {
        "$type": "color",
        "$value": "{color.border}"
      },
      "text": {
        "default": {
          "$type": "color",
          "$value": "#1b1b1b"
        },
        "muted": {
          "$type": "color",
          "$value": "#4d5965"
        },
        "inverse": {
          "$type": "color",
          "$value": "#ffffff"
        },
        "inverseMuted": {
          "$type": "color",
          "$value": "color-mix(in srgb, var(--ashlar-color-text-inverse), transparent 24%)"
        }
      },
      "action": {
        "primary": {
          "bg": {
            "$type": "color",
            "$value": "#005ea8"
          },
          "fg": {
            "$type": "color",
            "$value": "#ffffff"
          },
          "hover": {
            "$type": "color",
            "$value": "#1a4480"
          }
        },
        "secondary": {
          "bg": {
            "$type": "color",
            "$value": "#ffffff"
          },
          "fg": {
            "$type": "color",
            "$value": "#005ea8"
          },
          "border": {
            "$type": "color",
            "$value": "#005ea8"
          }
        }
      },
      "link": {
        "$type": "color",
        "$value": "{color.action.secondary.fg}"
      },
      "linkInverse": {
        "$type": "color",
        "$value": "{color.text.inverse}"
      },
      "focus": {
        "$type": "color",
        "$value": "#2491ff"
      },
      "status": {
        "infoBg": {
          "$type": "color",
          "$value": "#e7f6f8"
        },
        "infoFg": {
          "$type": "color",
          "$value": "#1b1b1b"
        },
        "infoBorder": {
          "$type": "color",
          "$value": "{color.action.primary.bg}"
        },
        "successBg": {
          "$type": "color",
          "$value": "#ecf3ec"
        },
        "warningBg": {
          "$type": "color",
          "$value": "#faf3d1"
        },
        "errorBg": {
          "$type": "color",
          "$value": "#f4e3db"
        },
        "errorBorder": {
          "$type": "color",
          "$value": "#d54309"
        },
        "errorFg": {
          "$type": "color",
          "$value": "#b50909"
        }
      }
    },
    "font": {
      "sans": {
        "$type": "fontFamily",
        "$value": "\"Public Sans\", \"Source Sans 3\", system-ui, sans-serif"
      }
    },
    "radius": {
      "control": {
        "$type": "dimension",
        "$value": "0.25rem"
      },
      "card": {
        "$type": "dimension",
        "$value": "0.375rem"
      },
      "panel": {
        "$type": "dimension",
        "$value": "0.5rem"
      }
    },
    "elevation": {
      "card": {
        "$type": "shadow",
        "$value": "0 1px 2px rgb(27 27 27 / 0.08)"
      },
      "panel": {
        "$type": "shadow",
        "$value": "0 10px 28px rgb(27 27 27 / 0.08)"
      }
    },
    "component": {
      "button": {
        "radius": {
          "$type": "dimension",
          "$value": "{radius.control}"
        },
        "minBlockSize": {
          "$type": "dimension",
          "$value": "2.75rem"
        }
      },
      "card": {
        "radius": {
          "$type": "dimension",
          "$value": "{radius.card}"
        },
        "shadow": {
          "$type": "shadow",
          "$value": "{elevation.card}"
        }
      }
    },
    "focus": {
      "ring": {
        "color": {
          "$type": "color",
          "$value": "{color.focus}"
        },
        "width": {
          "$type": "dimension",
          "$value": "0.25rem"
        },
        "offset": {
          "$type": "dimension",
          "$value": "0.18rem"
        }
      }
    }
  },
  "modes": {
    "dark": {
      "color": {
        "page": {
          "$type": "color",
          "$value": "#111827"
        },
        "surface": {
          "$type": "color",
          "$value": "#182230"
        },
        "surfaceRaised": {
          "$type": "color",
          "$value": "#1f2a37"
        },
        "surfaceSubtle": {
          "$type": "color",
          "$value": "#253347"
        },
        "border": {
          "$type": "color",
          "$value": "#4b5565"
        },
        "text": {
          "default": {
            "$type": "color",
            "$value": "#f8fafc"
          },
          "muted": {
            "$type": "color",
            "$value": "#cbd5e1"
          },
          "inverse": {
            "$type": "color",
            "$value": "#ffffff"
          }
        },
        "action": {
          "primary": {
            "bg": {
              "$type": "color",
              "$value": "#58b4ff"
            },
            "fg": {
              "$type": "color",
              "$value": "#111827"
            },
            "hover": {
              "$type": "color",
              "$value": "#a1d3ff"
            }
          },
          "secondary": {
            "bg": {
              "$type": "color",
              "$value": "#111827"
            },
            "fg": {
              "$type": "color",
              "$value": "#58b4ff"
            },
            "border": {
              "$type": "color",
              "$value": "#58b4ff"
            }
          }
        },
        "focus": {
          "$type": "color",
          "$value": "#face00"
        },
        "status": {
          "infoBg": {
            "$type": "color",
            "$value": "#1f2a37"
          },
          "infoFg": {
            "$type": "color",
            "$value": "#f8fafc"
          },
          "successBg": {
            "$type": "color",
            "$value": "#1f3329"
          },
          "warningBg": {
            "$type": "color",
            "$value": "#3d2f12"
          },
          "errorBg": {
            "$type": "color",
            "$value": "#3f241f"
          },
          "errorBorder": {
            "$type": "color",
            "$value": "#ff8d7b"
          },
          "errorFg": {
            "$type": "color",
            "$value": "#fdb8ae"
          }
        }
      }
    }
  }
}
